{
  "$schema": "./schema.json",
  "id": "icml",
  "name": "ICML",
  "edition": "2025",
  "pageLimit": 8,
  "doubleBlind": true,
  "paperSize": "letter",
  "referencesCountTowardLimit": false,
  "fonts": { "allowType3": false, "requireAllEmbedded": true },
  "cfpUrl": "https://icml.cc/Conferences/2025/CallForPapers",
  "notes": "Main body limit; references and appendix are unlimited. The style guide asks for Type-1 fonts only.",
  "unverified": ["pageLimit", "paperSize", "referencesCountTowardLimit", "fonts", "cfpUrl"],
  "lastChecked": null
}
