{
  "$schema": "./schema.json",
  "id": "iclr",
  "name": "ICLR",
  "edition": "2027",
  "pageLimit": 9,
  "doubleBlind": true,
  "paperSize": "letter",
  "referencesCountTowardLimit": false,
  "fonts": { "allowType3": true, "requireAllEmbedded": false },
  "cfpUrl": "https://iclr.cc/Conferences/2027/AuthorGuidelines",
  "notes": "Main text strictly limited to 9 pages at submission (10 pages during discussion and for the camera-ready). References, appendices, the optional ethics and reproducibility statements and the required LLM-use disclosure are not counted.",
  "sources": [
    "https://iclr.cc/Conferences/2027/AuthorGuidelines",
    "https://iclr.cc/Conferences/2027/CallForPapers"
  ],
  "unverified": ["paperSize", "fonts"],
  "lastChecked": "2026-10-21"
}
